{
  "allowedEntrypoints": [
    "src.api.main:app",
    "src.services.agent_runtime_hard_interface_v230_service:run_agent_pipeline_tick_hard"
  ],
  "attestedFiles": [
    {
      "path": ".github/workflows/historical-contract-audit.yml",
      "sha256": "81ad399dbb9129439b7d0a3cbdde7c9e161776b89ca145be9fa557afc3e1474d",
      "size": 1587
    },
    {
      "path": ".github/workflows/release-hash-seal.yml",
      "sha256": "6c87cc4296cf5b1be61888b61b31a8620426d8c8660c4e4050baae77628a7834",
      "size": 20952
    },
    {
      "path": "README.md",
      "sha256": "f6b44d3a91f2d6b0a825f7f893fcf7a43c48c2e5e5786ad6f1e34e213ae3512b",
      "size": 11511
    },
    {
      "path": "VERSION.md",
      "sha256": "bf6fbfe44a2d4a2837e7a82f123a9c8df29757d484856f265b13611a691f836c",
      "size": 10601
    },
    {
      "path": "docs/V22.4.0.7_GITHUB_ARTIFACT_TRANSPORT.md",
      "sha256": "3e0245bf0868335876452316ccb4bd16ba1d770a61442a4a9a9be7020c167276",
      "size": 4661
    },
    {
      "path": "docs/V22.4.0_RELEASE_HASH_SEAL.md",
      "sha256": "cb4b4ed5a901ce08204d9bd4148165dd0b6b4fdbac33eecf82392c7c301df889",
      "size": 11537
    },
    {
      "path": "pytest.ini",
      "sha256": "1da51ede09c159c9715466ce9cc2d37c541f8464702520b440bbe78e1f2cd79a",
      "size": 140
    },
    {
      "path": "requirements-dev.lock",
      "sha256": "3b01965d878d0f492b514c431f1ae21d7c2e5615961a85bd734c80fd90c09f50",
      "size": 137
    },
    {
      "path": "scripts/check_python36_bootstrap.py",
      "sha256": "485474b94a00775fb1933cbf886fed2450784553d1aa86bdd79b6b34c6d31601",
      "size": 2106
    },
    {
      "path": "scripts/check_release_contract.py",
      "sha256": "26bae32fd678261ae85c969d2bec150d500eaf0086ee14c5c09cfc02cc22c2be",
      "size": 18773
    },
    {
      "path": "scripts/deploy_github_artifact.sh",
      "sha256": "c927ae8fbbc7fbe19ee8da0a313f75f8bc7b1a16ead1bdb9908277beff2e865e",
      "size": 1743
    },
    {
      "path": "scripts/generate_release_manifest.py",
      "sha256": "1e1aea5b955edfb891dfadad24206515acd57ce1c7195b11fd2e8034b750b5cb",
      "size": 19882
    },
    {
      "path": "tests/__init__.py",
      "sha256": "e3b0c44298fc1c149afbf4c8996fb92427ae41e4649b934ca495991b7852b855",
      "size": 0
    },
    {
      "path": "tests/test_agent2_context_dedupe_v2251.py",
      "sha256": "b2d3098ad708fb3f86a0e8aa0e454f5a7e3c38306485a3ef54a43dcab2abb20e",
      "size": 8448
    },
    {
      "path": "tests/test_agent2_request_cache_identity_v2253.py",
      "sha256": "9d5de7d2a9d2e588a69307b0427313875c1aa51b92f1e7a1dfbef48099f8a427",
      "size": 5657
    },
    {
      "path": "tests/test_agent_token_runtime_v2241.py",
      "sha256": "dda694a3bb09c5a6d1b7e78b4e3459593abb4e25e6570f9e6d4438635d443801",
      "size": 3633
    },
    {
      "path": "tests/test_release_governance_registry_compiler_z0_9_compute_relief.py",
      "sha256": "be65b4d03825624dbacc030265ff6ea4d8f9eaaf5d5820dac56a3e4d62f91f90",
      "size": 5853
    },
    {
      "path": "tests/test_release_governance_registry_compiler_z1_0_5_ai_adapter_lock.py",
      "sha256": "97ba158c216c14c74af9de55b9f2c45fa3cac686faaefb20a22f5624ef030261",
      "size": 7585
    },
    {
      "path": "tests/test_release_governance_registry_compiler_z1_0_5_root_equivalence.py",
      "sha256": "3108358ea01d18866d6c8ace9b54e7939d8730af42efed54567773cb01758795",
      "size": 6196
    },
    {
      "path": "tests/test_release_governance_registry_compiler_z1_0_5_root_migration.py",
      "sha256": "07ee618e2b9dbc19ba86483483e3e271c5c6f74b4bda3c3f31b6ad01624ba8fb",
      "size": 3056
    },
    {
      "path": "tests/test_release_governance_registry_compiler_z1_l_level_permissions.py",
      "sha256": "eb3a22eb08e174bb16a6a9618f1522969ce6ef8d1c766a7528e439979f543e44",
      "size": 6199
    },
    {
      "path": "tests/test_release_governance_registry_compiler_z1_runtime_lineage.py",
      "sha256": "4bc7a2032f04a98a3a5af53e8ac7c58b8c86126452108853f211cd4c31044b77",
      "size": 5876
    },
    {
      "path": "tests/test_release_governance_z1_0_5_dependency_mode.py",
      "sha256": "429f32f65b00835f814246f51edb4d75858d71b96fd750cad15fdbe9b714fbc4",
      "size": 3924
    },
    {
      "path": "tests/test_signal_pool_v2144.py",
      "sha256": "3848ed602b2a87761caed830cf656620f7e167d88b134d1016ddd6abed728db5",
      "size": 8204
    },
    {
      "path": "tests/test_single_deployment_authority_v2254.py",
      "sha256": "e15c93e4ae5d897ef1b8934ef3d013759d7dd8b7c902c55e4d477714752f964e",
      "size": 6347
    },
    {
      "path": "tests/test_three_agent_pipeline_v225.py",
      "sha256": "155bf590f256cf7a5663c07f23f93f502aaba3cc3856d1235f707592451c2ed9",
      "size": 9497
    },
    {
      "path": "tests/test_v2027_agent_mainline_contract.py",
      "sha256": "66e1d1531f1e54d3940d9d1c24e15abe2116555c22924df048b2277018ae204e",
      "size": 6751
    },
    {
      "path": "tests/test_v2152_runtime_seal.py",
      "sha256": "9eb96a65ac3686ec0688786fd30531ac93fe6efb20b3d8af34d287ac75dd2792",
      "size": 5152
    },
    {
      "path": "tests/test_v215_report_batch_evidence.py",
      "sha256": "560a06cd6a26978a7b224a764baa9ac8bf6af48f67c04d36bdda967941e391c5",
      "size": 9157
    },
    {
      "path": "tests/test_v2161_agent_entry_interface.py",
      "sha256": "d6547a6c375204efed80acefa1052b8f7091819c725a751eb75b61a58788ed46",
      "size": 8026
    },
    {
      "path": "tests/test_v216_agent2_experiment_policy.py",
      "sha256": "1c81198ef145d121b40f41cb6cf4ea53891a33ba1ff7e8824fd5714bb6a68e38",
      "size": 5637
    },
    {
      "path": "tests/test_v216_agent_experiment_policy.py",
      "sha256": "c0a5e2b5cfc0028ce0641d2c2509d958546821537f9d5e21dd515cb6242df7d2",
      "size": 3887
    },
    {
      "path": "tests/test_v216_observation_experiment.py",
      "sha256": "8cb58893b06e2e3c817bf5ddcd60cb22169f556c7048e130378ea5d8cc82454f",
      "size": 4791
    },
    {
      "path": "tests/test_v2171_agent2_contract_alignment.py",
      "sha256": "6c22c8c29ffdde8f841a8d413d560f6949f23ea7a0bc73138c7870d95f8b3a6f",
      "size": 5876
    },
    {
      "path": "tests/test_v2172_inventory_action_guard.py",
      "sha256": "84548a29d801c6dd8c8eef1227c38ca8d475014e97831d6ed43a6206c4a95078",
      "size": 8870
    },
    {
      "path": "tests/test_v2173_agent2_policy_shape_recovery.py",
      "sha256": "ecc3cea25e717f8f67e3bb75bec13acd90ee61b29d15fa64509ce18ed8280913",
      "size": 9478
    },
    {
      "path": "tests/test_v2174_action_plan_ir_budget_metadata.py",
      "sha256": "2fe76f8d3ed22f41d5d6766057eedfde4392da1b01edf3a25e82440b87f83229",
      "size": 2248
    },
    {
      "path": "tests/test_v2174_budget_governance.py",
      "sha256": "8d48928b965181a0d5ceab4c53d215114e06a8adb97baa9f0bc44cfd3b508f82",
      "size": 11085
    },
    {
      "path": "tests/test_v2175_agent2_final_contract_rebuild.py",
      "sha256": "aad10ea4fa0c058391498f7988a1540b9866ccc8d00133a1b692f0180e65b13b",
      "size": 10070
    },
    {
      "path": "tests/test_v2176_sop_mapping_runtime.py",
      "sha256": "24359f568becdd555286bfecb2503638a60011a834509038676a006d18279416",
      "size": 6719
    },
    {
      "path": "tests/test_v2177_agent2_single_action_contract.py",
      "sha256": "0b14944cd513db39d8ffdc95317be226b0e84281c0943a36f7904dcc0678bee1",
      "size": 9604
    },
    {
      "path": "tests/test_v2177_structured_sop_projection.py",
      "sha256": "974ac4584f00a20caf2448537a8613fd6e7b02fe55ec0fadf2d2b2571108ad08",
      "size": 7248
    },
    {
      "path": "tests/test_v2177_task_detail_interface.py",
      "sha256": "2cce6f4f8032700e0571f5c9caa00d8664baae2c1ecfa2e48284dace5b773567",
      "size": 8935
    },
    {
      "path": "tests/test_v2178_task_metric_evidence_projection.py",
      "sha256": "4171606ce69bcd0a4aadb1fc7f45cd39858a94098f81cc67512279582866117a",
      "size": 6027
    },
    {
      "path": "tests/test_v217_product_trend_read_model.py",
      "sha256": "1b302d78fcb0e5725727b7890478b665d24956866f24c8f89b91a09f706d1bc4",
      "size": 3920
    },
    {
      "path": "tests/test_v2180_neural_operating_ui.py",
      "sha256": "82edb1920fcf6f155b88e54a750f6f1f9fa1e4c29514bf82f03f6d82d5e051df",
      "size": 4771
    },
    {
      "path": "tests/test_v22_2_6_1_runtime_recovery.py",
      "sha256": "2f53b90d82d5e51f095baddea488a06b7ba5ed30dce7074cbe9df86acddd6044",
      "size": 8907
    },
    {
      "path": "tests/test_v22_2_6_2_deployment_backup_rotation.py",
      "sha256": "7f7922984e31a577555b20e28e7abf63784a401d201adb5701a54e1876b18fd3",
      "size": 4827
    },
    {
      "path": "tests/test_v22_2_6_3_native_agent_runtime.py",
      "sha256": "9951205c8a50e4727569fd0d5c1cca0359818263a60f96c071c951c61554049d",
      "size": 9545
    },
    {
      "path": "tests/test_v22_2_6_end_to_end_agent_flow.py",
      "sha256": "f0ea59df630145c013dd27bf65a75adf7b5e75c660bae192377c866c073facfb",
      "size": 12054
    },
    {
      "path": "tests/test_v22_2_6_observed_repair.py",
      "sha256": "c6cbb5163739266152c4084db820cc3408e84b71822b5a387ad69a2c445f7ab0",
      "size": 4250
    },
    {
      "path": "tests/test_v22_2_artifact_hub.py",
      "sha256": "3af68db7a4cb430bce4db29f8c7b68c09c4d3e5ce3149f6189dfa8cdc2b90b61",
      "size": 5768
    },
    {
      "path": "tests/test_v22_2_context_projection.py",
      "sha256": "844103217517623904cdeda3574ea9d54d67367cf10adcdbb12126bbbcc9ac23",
      "size": 7547
    },
    {
      "path": "tests/test_v22_2_public_task_dto.py",
      "sha256": "83c4676f3ea72e003d6395c7495179ee31a009ba9d88ecdcd6b33a0433ad6e31",
      "size": 6622
    },
    {
      "path": "tests/test_v22_2_reference_pipeline.py",
      "sha256": "273a52c38553eaaa3f308c82fe0a0aa08096fd513c1f42f7ab859cafb2f4b81c",
      "size": 8605
    },
    {
      "path": "tests/test_v22_2_station_truth.py",
      "sha256": "514b02488c167185ea4b23af6fd55a379d36d8191f2bb8bfbc2daef375768beb",